lact/.cache_triton_llm/FDQZUP57FBYEJWNTJ4LYVSLLKUH3QHSRAR7432YSJ2XS2Q67UTQQ/layer_norm_fwd_kernel1.autotune.json
{"key": [768, false, false, true, "torch.float32", "torch.float32", "torch.float32", "torch.float32"], "configs_timings": [[{"kwargs": {}, "num_warps": 2, "num_ctas": 1, "num_stages": 3, "maxnreg": null, "pre_hook": null, "ir_override": null}, [0.014527999795973301, 0.014336000196635723, 0.01539199985563755]], [{"kwargs": {}, "num_warps": 4, "num_ctas": 1, "num_stages": 3, "maxnreg": null, "pre_hook": null, "ir_override": null}, [0.014431999996304512, 0.014303999952971935, 0.015231999568641186]], [{"kwargs": {}, "num_warps": 8, "num_ctas": 1, "num_stages": 3, "maxnreg": null, "pre_hook": null, "ir_override": null}, [0.017343999817967415, 0.016736000776290894, 0.018464000895619392]], [{"kwargs": {}, "num_warps": 16, "num_ctas": 1, "num_stages": 3, "maxnreg": null, "pre_hook": null, "ir_override": null}, [0.024671999737620354, 0.02457600086927414, 0.025407999753952026]]]}