lact/.cache_triton_llm/PMJUXA76Y7WOWIZAQ53TO27ZXCNPL52WYSIMFT4KDSKXIKLVQZ6A/layer_norm_fwd_kernel1.autotune.json
{"key": [768, true, true, true, "torch.float32", "torch.float32", "torch.float32", "torch.float32", "torch.float32", "torch.float32"], "configs_timings": [[{"kwargs": {}, "num_warps": 2, "num_ctas": 1, "num_stages": 3, "maxnreg": null, "pre_hook": null, "ir_override": null}, [0.02252800017595291, 0.021407999098300934, 0.022592000663280487]], [{"kwargs": {}, "num_warps": 4, "num_ctas": 1, "num_stages": 3, "maxnreg": null, "pre_hook": null, "ir_override": null}, [0.0225600004196167, 0.022463999688625336, 0.0226879995316267]], [{"kwargs": {}, "num_warps": 8, "num_ctas": 1, "num_stages": 3, "maxnreg": null, "pre_hook": null, "ir_override": null}, [0.022816000506281853, 0.0225600004196167, 0.02364799939095974]], [{"kwargs": {}, "num_warps": 16, "num_ctas": 1, "num_stages": 3, "maxnreg": null, "pre_hook": null, "ir_override": null}, [0.030688000842928886, 0.029472000896930695, 0.030751999467611313]]]}