lact/.cache_triton_llm/4OKHV2JWIUN6TZ3GQA6RLZM7FVOTMR53HXENVA3HVPCXTIWSQWGA/swiglu_fwdbwd_kernel.autotune.json
{"key": [2048, "torch.bfloat16", "torch.bfloat16", "torch.bfloat16", "torch.bfloat16", "torch.bfloat16", "torch.bfloat16"], "configs_timings": [[{"kwargs": {"B": 512}, "num_warps": 1, "num_ctas": 1, "num_stages": 3, "maxnreg": null, "pre_hook": null, "ir_override": null}, [0.10444799810647964, 0.10335999727249146, 0.10512000322341919]], [{"kwargs": {"B": 512}, "num_warps": 2, "num_ctas": 1, "num_stages": 3, "maxnreg": null, "pre_hook": null, "ir_override": null}, [0.11059200018644333, 0.10953599959611893, 0.11072000116109848]], [{"kwargs": {"B": 512}, "num_warps": 4, "num_ctas": 1, "num_stages": 3, "maxnreg": null, "pre_hook": null, "ir_override": null}, [0.05737600103020668, 0.057312000542879105, 0.05753599852323532]], [{"kwargs": {"B": 512}, "num_warps": 8, "num_ctas": 1, "num_stages": 3, "maxnreg": null, "pre_hook": null, "ir_override": null}, [0.055296000093221664, 0.054207999259233475, 0.05532800033688545]], [{"kwargs": {"B": 512}, "num_warps": 16, "num_ctas": 1, "num_stages": 3, "maxnreg": null, "pre_hook": null, "ir_override": null}, [0.0756480023264885, 0.0740479975938797, 0.07580800354480743]], [{"kwargs": {"B": 512}, "num_warps": 32, "num_ctas": 1, "num_stages": 3, "maxnreg": null, "pre_hook": null, "ir_override": null}, [0.14959999918937683, 0.14950400590896606, 0.15036800503730774]], [{"kwargs": {"B": 1024}, "num_warps": 1, "num_ctas": 1, "num_stages": 3, "maxnreg": null, "pre_hook": null, "ir_override": null}, [0.13545599579811096, 0.13519999384880066, 0.1372160017490387]], [{"kwargs": {"B": 1024}, "num_warps": 2, "num_ctas": 1, "num_stages": 3, "maxnreg": null, "pre_hook": null, "ir_override": null}, [0.11055999994277954, 0.10867200046777725, 0.11072000116109848]], [{"kwargs": {"B": 1024}, "num_warps": 4, "num_ctas": 1, "num_stages": 3, "maxnreg": null, "pre_hook": null, "ir_override": null}, [0.10735999792814255, 0.10662399977445602, 0.10857599973678589]], [{"kwargs": {"B": 1024}, "num_warps": 8, "num_ctas": 1, "num_stages": 3, "maxnreg": null, "pre_hook": null, "ir_override": null}, [0.05737600103020668, 0.057312000542879105, 0.05804799869656563]], [{"kwargs": {"B": 1024}, "num_warps": 16, "num_ctas": 1, "num_stages": 3, "maxnreg": null, "pre_hook": null, "ir_override": null}, [0.0560000017285347, 0.05548800155520439, 0.057312000542879105]], [{"kwargs": {"B": 1024}, "num_warps": 32, "num_ctas": 1, "num_stages": 3, "maxnreg": null, "pre_hook": null, "ir_override": null}, [0.07782399654388428, 0.07769600301980972, 0.07788799703121185]], [{"kwargs": {"B": 2048}, "num_warps": 1, "num_ctas": 1, "num_stages": 3, "maxnreg": null, "pre_hook": null, "ir_override": null}, [0.1475519984960556, 0.14742399752140045, 0.14854399859905243]], [{"kwargs": {"B": 2048}, "num_warps": 2, "num_ctas": 1, "num_stages": 3, "maxnreg": null, "pre_hook": null, "ir_override": null}, [0.11881600320339203, 0.1178240031003952, 0.1196800023317337]], [{"kwargs": {"B": 2048}, "num_warps": 4, "num_ctas": 1, "num_stages": 3, "maxnreg": null, "pre_hook": null, "ir_override": null}, [0.11748800054192543, 0.1167680025100708, 0.11881600320339203]], [{"kwargs": {"B": 2048}, "num_warps": 8, "num_ctas": 1, "num_stages": 3, "maxnreg": null, "pre_hook": null, "ir_override": null}, [0.10444799810647964, 0.10358399897813797, 0.10460799932479858]], [{"kwargs": {"B": 2048}, "num_warps": 16, "num_ctas": 1, "num_stages": 3, "maxnreg": null, "pre_hook": null, "ir_override": null}, [0.06576000154018402, 0.0655680000782013, 0.06646399945020676]], [{"kwargs": {"B": 2048}, "num_warps": 32, "num_ctas": 1, "num_stages": 3, "maxnreg": null, "pre_hook": null, "ir_override": null}, [0.05539200082421303, 0.055296000093221664, 0.05612799897789955]], [{"kwargs": {"B": 4096}, "num_warps": 1, "num_ctas": 1, "num_stages": 3, "maxnreg": null, "pre_hook": null, "ir_override": null}, [0.5836640000343323, 0.580070412158966, 0.5858304142951966]], [{"kwargs": {"B": 4096}, "num_warps": 2, "num_ctas": 1, "num_stages": 3, "maxnreg": null, "pre_hook": null, "ir_override": null}, [0.5959680080413818, 0.5929215908050537, 0.599014413356781]], [{"kwargs": {"B": 4096}, "num_warps": 4, "num_ctas": 1, "num_stages": 3, "maxnreg": null, "pre_hook": null, "ir_override": null}, [0.14547200500965118, 0.14534400403499603, 0.14636799693107605]], [{"kwargs": {"B": 4096}, "num_warps": 8, "num_ctas": 1, "num_stages": 3, "maxnreg": null, "pre_hook": null, "ir_override": null}, [0.1311040073633194, 0.13100799918174744, 0.13139840066432953]], [{"kwargs": {"B": 4096}, "num_warps": 16, "num_ctas": 1, "num_stages": 3, "maxnreg": null, "pre_hook": null, "ir_override": null}, [0.11673600226640701, 0.1157120019197464, 0.11686400324106216]], [{"kwargs": {"B": 4096}, "num_warps": 32, "num_ctas": 1, "num_stages": 3, "maxnreg": null, "pre_hook": null, "ir_override": null}, [0.06351999938488007, 0.06345599889755249, 0.06371200084686279]], [{"kwargs": {"B": 8192}, "num_warps": 1, "num_ctas": 1, "num_stages": 3, "maxnreg": null, "pre_hook": null, "ir_override": null}, [0.7711039781570435, 0.7699199914932251, 0.7730240225791931]], [{"kwargs": {"B": 8192}, "num_warps": 2, "num_ctas": 1, "num_stages": 3, "maxnreg": null, "pre_hook": null, "ir_override": null}, [0.6633279919624329, 0.6605119705200195, 0.6656320095062256]], [{"kwargs": {"B": 8192}, "num_warps": 4, "num_ctas": 1, "num_stages": 3, "maxnreg": null, "pre_hook": null, "ir_override": null}, [0.5926399827003479, 0.5886080265045166, 0.5960000157356262]], [{"kwargs": {"B": 8192}, "num_warps": 8, "num_ctas": 1, "num_stages": 3, "maxnreg": null, "pre_hook": null, "ir_override": null}, [0.14959999918937683, 0.14950400590896606, 0.15043200552463531]], [{"kwargs": {"B": 8192}, "num_warps": 16, "num_ctas": 1, "num_stages": 3, "maxnreg": null, "pre_hook": null, "ir_override": null}, [0.17817600071430206, 0.17715199291706085, 0.17827199399471283]], [{"kwargs": {"B": 8192}, "num_warps": 32, "num_ctas": 1, "num_stages": 3, "maxnreg": null, "pre_hook": null, "ir_override": null}, [0.14336000382900238, 0.14328320026397706, 0.14348800480365753]]]}