lact/.cache_triton_llm/QEMK5KEWOKRCS5NDSJ2VUNSF7IZ5KL2UBZC3DRWVIQQQMO2Y5S5Q/layer_norm_fwd_kernel.autotune.json
{"key": [192, 16, false, false, true, "torch.bfloat16", "torch.bfloat16", "torch.float32", "torch.float32"], "configs_timings": [[{"kwargs": {"BT": 32}, "num_warps": 2, "num_ctas": 1, "num_stages": 3, "maxnreg": null, "pre_hook": null, "ir_override": null}, [0.027488000690937042, 0.026815999299287796, 0.028672000393271446]], [{"kwargs": {"BT": 32}, "num_warps": 4, "num_ctas": 1, "num_stages": 3, "maxnreg": null, "pre_hook": null, "ir_override": null}, [0.018559999763965607, 0.018432000651955605, 0.01929599978029728]], [{"kwargs": {"BT": 32}, "num_warps": 8, "num_ctas": 1, "num_stages": 3, "maxnreg": null, "pre_hook": null, "ir_override": null}, [0.013376000337302685, 0.012640000320971012, 0.014368000440299511]], [{"kwargs": {"BT": 64}, "num_warps": 2, "num_ctas": 1, "num_stages": 3, "maxnreg": null, "pre_hook": null, "ir_override": null}, [0.07372800260782242, 0.07363200187683105, 0.07446400076150894]], [{"kwargs": {"BT": 64}, "num_warps": 4, "num_ctas": 1, "num_stages": 3, "maxnreg": null, "pre_hook": null, "ir_override": null}, [0.028672000393271446, 0.028575999662280083, 0.028736000880599022]], [{"kwargs": {"BT": 64}, "num_warps": 8, "num_ctas": 1, "num_stages": 3, "maxnreg": null, "pre_hook": null, "ir_override": null}, [0.020479999482631683, 0.01971839927136898, 0.02051199972629547]], [{"kwargs": {"BT": 128}, "num_warps": 2, "num_ctas": 1, "num_stages": 3, "maxnreg": null, "pre_hook": null, "ir_override": null}, [0.1393280029296875, 0.1382720023393631, 0.14126079976558686]], [{"kwargs": {"BT": 128}, "num_warps": 4, "num_ctas": 1, "num_stages": 3, "maxnreg": null, "pre_hook": null, "ir_override": null}, [0.07177600264549255, 0.07168000191450119, 0.07257600128650665]], [{"kwargs": {"BT": 128}, "num_warps": 8, "num_ctas": 1, "num_stages": 3, "maxnreg": null, "pre_hook": null, "ir_override": null}, [0.028736000880599022, 0.028672000393271446, 0.029503999277949333]]]}