lact/.cache_triton_llm/2BSQ5THSLXDJBHSQM723LP2NON53HFPPKE2LP4QJQWP4K2VBJTOQ/rotary_embedding_kernel.autotune.json
{"key": [8, 12, 64, false, "torch.bfloat16", "torch.bfloat16", "torch.bfloat16", "torch.bfloat16"], "configs_timings": [[{"kwargs": {}, "num_warps": 2, "num_ctas": 1, "num_stages": 2, "maxnreg": null, "pre_hook": null, "ir_override": null}, [0.024831999093294144, 0.024671999737620354, 0.025567999109625816]], [{"kwargs": {}, "num_warps": 2, "num_ctas": 1, "num_stages": 3, "maxnreg": null, "pre_hook": null, "ir_override": null}, [0.024831999093294144, 0.02470399998128414, 0.025567999109625816]], [{"kwargs": {}, "num_warps": 2, "num_ctas": 1, "num_stages": 4, "maxnreg": null, "pre_hook": null, "ir_override": null}, [0.024831999093294144, 0.024671999737620354, 0.025599999353289604]], [{"kwargs": {}, "num_warps": 4, "num_ctas": 1, "num_stages": 2, "maxnreg": null, "pre_hook": null, "ir_override": null}, [0.024607999250292778, 0.02454400062561035, 0.02473600022494793]], [{"kwargs": {}, "num_warps": 4, "num_ctas": 1, "num_stages": 3, "maxnreg": null, "pre_hook": null, "ir_override": null}, [0.024607999250292778, 0.02454400062561035, 0.02473600022494793]], [{"kwargs": {}, "num_warps": 4, "num_ctas": 1, "num_stages": 4, "maxnreg": null, "pre_hook": null, "ir_override": null}, [0.024607999250292778, 0.02454400062561035, 0.02470399998128414]], [{"kwargs": {}, "num_warps": 8, "num_ctas": 1, "num_stages": 2, "maxnreg": null, "pre_hook": null, "ir_override": null}, [0.026863999664783478, 0.02672000043094158, 0.027615999802947044]], [{"kwargs": {}, "num_warps": 8, "num_ctas": 1, "num_stages": 3, "maxnreg": null, "pre_hook": null, "ir_override": null}, [0.026847999542951584, 0.02672000043094158, 0.027583999559283257]], [{"kwargs": {}, "num_warps": 8, "num_ctas": 1, "num_stages": 4, "maxnreg": null, "pre_hook": null, "ir_override": null}, [0.02687999978661537, 0.02672000043094158, 0.02768000029027462]], [{"kwargs": {}, "num_warps": 16, "num_ctas": 1, "num_stages": 2, "maxnreg": null, "pre_hook": null, "ir_override": null}, [0.03686400130391121, 0.03680000081658363, 0.036928001791238785]], [{"kwargs": {}, "num_warps": 16, "num_ctas": 1, "num_stages": 3, "maxnreg": null, "pre_hook": null, "ir_override": null}, [0.03686400130391121, 0.03680000081658363, 0.036928001791238785]], [{"kwargs": {}, "num_warps": 16, "num_ctas": 1, "num_stages": 4, "maxnreg": null, "pre_hook": null, "ir_override": null}, [0.03686400130391121, 0.036768000572919846, 0.036896001547575]], [{"kwargs": {}, "num_warps": 32, "num_ctas": 1, "num_stages": 2, "maxnreg": null, "pre_hook": null, "ir_override": null}, [0.0655359998345375, 0.0655359998345375, 0.06617599725723267]], [{"kwargs": {}, "num_warps": 32, "num_ctas": 1, "num_stages": 3, "maxnreg": null, "pre_hook": null, "ir_override": null}, [0.0655359998345375, 0.0655359998345375, 0.06585600227117538]], [{"kwargs": {}, "num_warps": 32, "num_ctas": 1, "num_stages": 4, "maxnreg": null, "pre_hook": null, "ir_override": null}, [0.0655359998345375, 0.0655359998345375, 0.0657472014427185]]]}