lact/.cache_triton_llm/DGVPP6E7IM6CIFPOHXMGFTSXNY3R5KJYUXRRJEQ3L6ZRAGHZQN4Q/layer_norm_fwd_kernel1.autotune.json
{"key": [768, true, true, true, "torch.bfloat16", "torch.bfloat16", "torch.float32", "torch.float32", "torch.float32", "torch.float32"], "configs_timings": [[{"kwargs": {}, "num_warps": 2, "num_ctas": 1, "num_stages": 3, "maxnreg": null, "pre_hook": null, "ir_override": null}, [0.13926400244235992, 0.1382399946451187, 0.1393280029296875]], [{"kwargs": {}, "num_warps": 4, "num_ctas": 1, "num_stages": 3, "maxnreg": null, "pre_hook": null, "ir_override": null}, [0.13731199502944946, 0.1371839940547943, 0.13792000710964203]], [{"kwargs": {}, "num_warps": 8, "num_ctas": 1, "num_stages": 3, "maxnreg": null, "pre_hook": null, "ir_override": null}, [0.15564799308776855, 0.15558399260044098, 0.15574400126934052]], [{"kwargs": {}, "num_warps": 16, "num_ctas": 1, "num_stages": 3, "maxnreg": null, "pre_hook": null, "ir_override": null}, [0.2537919878959656, 0.25231999158859253, 0.2539840042591095]]]}