lact/.cache_triton_llm/3LYJKHUIJMAV2TQ76VXQVGYEHNTWHFXJJ4HG6W2QEGNDTGEFPWRQ/layer_norm_bwd_kernel1.autotune.json
{"key": [768, true, true, true, "torch.float32", "torch.float32", "torch.bfloat16", "torch.bfloat16", "torch.float32", "torch.float32", "torch.float32", "torch.float32"], "configs_timings": [[{"kwargs": {}, "num_warps": 2, "num_ctas": 1, "num_stages": 3, "maxnreg": null, "pre_hook": null, "ir_override": null}, [1.043455958366394, 1.042464017868042, 1.0446399450302124]], [{"kwargs": {}, "num_warps": 4, "num_ctas": 1, "num_stages": 3, "maxnreg": null, "pre_hook": null, "ir_override": null}, [1.0178560018539429, 1.0166847944259643, 1.018899178504944]], [{"kwargs": {}, "num_warps": 8, "num_ctas": 1, "num_stages": 3, "maxnreg": null, "pre_hook": null, "ir_override": null}, [0.9554240107536316, 0.954367995262146, 0.9564480185508728]]]}