lact/.cache_triton_llm/JRR5Q7Z6DJSJOUQO2YTM4DMX4E7CZXK6MKHJTASN4BPG7RIT4TFQ/rotary_embedding_kernel.autotune.json
{"key": [2, 12, 64, false, "torch.bfloat16", "torch.bfloat16", "torch.bfloat16", "torch.bfloat16"], "configs_timings": [[{"kwargs": {}, "num_warps": 2, "num_ctas": 1, "num_stages": 2, "maxnreg": null, "pre_hook": null, "ir_override": null}, [0.012319999746978283, 0.01228800043463707, 0.01244799979031086]], [{"kwargs": {}, "num_warps": 2, "num_ctas": 1, "num_stages": 3, "maxnreg": null, "pre_hook": null, "ir_override": null}, [0.012319999746978283, 0.012256000190973282, 0.01244799979031086]], [{"kwargs": {}, "num_warps": 2, "num_ctas": 1, "num_stages": 4, "maxnreg": null, "pre_hook": null, "ir_override": null}, [0.012319999746978283, 0.01228800043463707, 0.01244799979031086]], [{"kwargs": {}, "num_warps": 4, "num_ctas": 1, "num_stages": 2, "maxnreg": null, "pre_hook": null, "ir_override": null}, [0.011231999844312668, 0.010495999827980995, 0.012319999746978283]], [{"kwargs": {}, "num_warps": 4, "num_ctas": 1, "num_stages": 3, "maxnreg": null, "pre_hook": null, "ir_override": null}, [0.011264000087976456, 0.010623999871313572, 0.012319999746978283]], [{"kwargs": {}, "num_warps": 4, "num_ctas": 1, "num_stages": 4, "maxnreg": null, "pre_hook": null, "ir_override": null}, [0.011264000087976456, 0.010591999627649784, 0.012319999746978283]], [{"kwargs": {}, "num_warps": 8, "num_ctas": 1, "num_stages": 2, "maxnreg": null, "pre_hook": null, "ir_override": null}, [0.01228800043463707, 0.012223999947309494, 0.012415999546647072]], [{"kwargs": {}, "num_warps": 8, "num_ctas": 1, "num_stages": 3, "maxnreg": null, "pre_hook": null, "ir_override": null}, [0.01228800043463707, 0.012223999947309494, 0.012384000234305859]], [{"kwargs": {}, "num_warps": 8, "num_ctas": 1, "num_stages": 4, "maxnreg": null, "pre_hook": null, "ir_override": null}, [0.01228800043463707, 0.012223999947309494, 0.012384000234305859]], [{"kwargs": {}, "num_warps": 16, "num_ctas": 1, "num_stages": 2, "maxnreg": null, "pre_hook": null, "ir_override": null}, [0.014336000196635723, 0.014303999952971935, 0.014495999552309513]], [{"kwargs": {}, "num_warps": 16, "num_ctas": 1, "num_stages": 3, "maxnreg": null, "pre_hook": null, "ir_override": null}, [0.014336000196635723, 0.014303999952971935, 0.014495999552309513]], [{"kwargs": {}, "num_warps": 16, "num_ctas": 1, "num_stages": 4, "maxnreg": null, "pre_hook": null, "ir_override": null}, [0.014336000196635723, 0.014303999952971935, 0.014495999552309513]], [{"kwargs": {}, "num_warps": 32, "num_ctas": 1, "num_stages": 2, "maxnreg": null, "pre_hook": null, "ir_override": null}, [0.02252800017595291, 0.02143999934196472, 0.0225600004196167]], [{"kwargs": {}, "num_warps": 32, "num_ctas": 1, "num_stages": 3, "maxnreg": null, "pre_hook": null, "ir_override": null}, [0.02252800017595291, 0.02143999934196472, 0.0225600004196167]], [{"kwargs": {}, "num_warps": 32, "num_ctas": 1, "num_stages": 4, "maxnreg": null, "pre_hook": null, "ir_override": null}, [0.02252800017595291, 0.02143999934196472, 0.022592000663280487]]]}