lact/.cache_triton_llm/O7B42K4KBA752O6BCABFUYOGE2YVNHQQZ4UF3D6WW4TCATGR6NVA/layer_norm_bwd_kernel.autotune.json
{"key": [192, 16, false, false, true, "torch.bfloat16", "torch.float32", "torch.bfloat16", "torch.bfloat16", "torch.float32", "torch.float32"], "configs_timings": [[{"kwargs": {"BT": 32}, "num_warps": 2, "num_ctas": 1, "num_stages": 3, "maxnreg": null, "pre_hook": null, "ir_override": null}, [0.06780800223350525, 0.06761600077152252, 0.06860800087451935]], [{"kwargs": {"BT": 32}, "num_warps": 4, "num_ctas": 1, "num_stages": 3, "maxnreg": null, "pre_hook": null, "ir_override": null}, [0.026655999943614006, 0.026559999212622643, 0.02672000043094158]], [{"kwargs": {"BT": 32}, "num_warps": 8, "num_ctas": 1, "num_stages": 3, "maxnreg": null, "pre_hook": null, "ir_override": null}, [0.03097599931061268, 0.030751999467611313, 0.03174399957060814]], [{"kwargs": {"BT": 64}, "num_warps": 2, "num_ctas": 1, "num_stages": 3, "maxnreg": null, "pre_hook": null, "ir_override": null}, [0.31964799761772156, 0.31360000371932983, 0.32870399951934814]], [{"kwargs": {"BT": 64}, "num_warps": 4, "num_ctas": 1, "num_stages": 3, "maxnreg": null, "pre_hook": null, "ir_override": null}, [0.04713600128889084, 0.04710400104522705, 0.04787199944257736]], [{"kwargs": {"BT": 64}, "num_warps": 8, "num_ctas": 1, "num_stages": 3, "maxnreg": null, "pre_hook": null, "ir_override": null}, [0.0225600004196167, 0.02252800017595291, 0.02332800067961216]]]}