lact/.cache_triton_llm/ODXBXSEYBTF5EN5DTZLIYDT4JG235KCXEZS6QPHPJJADFVT5T3SA/rotary_embedding_kernel.autotune.json
{"key": [24, 12, 64, false, "torch.bfloat16", "torch.bfloat16", "torch.bfloat16", "torch.bfloat16"], "configs_timings": [[{"kwargs": {}, "num_warps": 2, "num_ctas": 1, "num_stages": 2, "maxnreg": null, "pre_hook": null, "ir_override": null}, [0.06143999844789505, 0.06140799820423126, 0.06159999966621399]], [{"kwargs": {}, "num_warps": 2, "num_ctas": 1, "num_stages": 3, "maxnreg": null, "pre_hook": null, "ir_override": null}, [0.06147199869155884, 0.06140799820423126, 0.06159999966621399]], [{"kwargs": {}, "num_warps": 2, "num_ctas": 1, "num_stages": 4, "maxnreg": null, "pre_hook": null, "ir_override": null}, [0.06147199869155884, 0.06140799820423126, 0.0615679994225502]], [{"kwargs": {}, "num_warps": 4, "num_ctas": 1, "num_stages": 2, "maxnreg": null, "pre_hook": null, "ir_override": null}, [0.061344001442193985, 0.05942400172352791, 0.06147199869155884]], [{"kwargs": {}, "num_warps": 4, "num_ctas": 1, "num_stages": 3, "maxnreg": null, "pre_hook": null, "ir_override": null}, [0.06128000095486641, 0.05958399921655655, 0.06147199869155884]], [{"kwargs": {}, "num_warps": 4, "num_ctas": 1, "num_stages": 4, "maxnreg": null, "pre_hook": null, "ir_override": null}, [0.060736000537872314, 0.0594559982419014, 0.06147199869155884]], [{"kwargs": {}, "num_warps": 8, "num_ctas": 1, "num_stages": 2, "maxnreg": null, "pre_hook": null, "ir_override": null}, [0.06752000004053116, 0.06595200300216675, 0.06761600077152252]], [{"kwargs": {}, "num_warps": 8, "num_ctas": 1, "num_stages": 3, "maxnreg": null, "pre_hook": null, "ir_override": null}, [0.06752000004053116, 0.06592000275850296, 0.06761600077152252]], [{"kwargs": {}, "num_warps": 8, "num_ctas": 1, "num_stages": 4, "maxnreg": null, "pre_hook": null, "ir_override": null}, [0.06752000004053116, 0.0655680000782013, 0.06761600077152252]], [{"kwargs": {}, "num_warps": 16, "num_ctas": 1, "num_stages": 2, "maxnreg": null, "pre_hook": null, "ir_override": null}, [0.09404800087213516, 0.09216000139713287, 0.09424000233411789]], [{"kwargs": {}, "num_warps": 16, "num_ctas": 1, "num_stages": 3, "maxnreg": null, "pre_hook": null, "ir_override": null}, [0.09404800087213516, 0.09216000139713287, 0.09424000233411789]], [{"kwargs": {}, "num_warps": 16, "num_ctas": 1, "num_stages": 4, "maxnreg": null, "pre_hook": null, "ir_override": null}, [0.09414400160312653, 0.0922304019331932, 0.09424000233411789]], [{"kwargs": {}, "num_warps": 32, "num_ctas": 1, "num_stages": 2, "maxnreg": null, "pre_hook": null, "ir_override": null}, [0.1802240014076233, 0.18016000092029572, 0.18028800189495087]], [{"kwargs": {}, "num_warps": 32, "num_ctas": 1, "num_stages": 3, "maxnreg": null, "pre_hook": null, "ir_override": null}, [0.1802240014076233, 0.18015359938144684, 0.18031999468803406]], [{"kwargs": {}, "num_warps": 32, "num_ctas": 1, "num_stages": 4, "maxnreg": null, "pre_hook": null, "ir_override": null}, [0.1802240014076233, 0.18016000092029572, 0.18028800189495087]]]}