lact/.cache_triton_llm/CZ5HU7AYSTPC5PA23OCEQQB653WFAKGZSUGZUFTPD23JBNRUZ3HQ/rotary_embedding_kernel.autotune.json
{"key": [2, 12, 64, false, "torch.float32", "torch.float32", "torch.float32", "torch.float32"], "configs_timings": [[{"kwargs": {}, "num_warps": 2, "num_ctas": 1, "num_stages": 2, "maxnreg": null, "pre_hook": null, "ir_override": null}, [0.016416000202298164, 0.015615999698638916, 0.016448000445961952]], [{"kwargs": {}, "num_warps": 2, "num_ctas": 1, "num_stages": 3, "maxnreg": null, "pre_hook": null, "ir_override": null}, [0.016416000202298164, 0.016287999227643013, 0.016448000445961952]], [{"kwargs": {}, "num_warps": 2, "num_ctas": 1, "num_stages": 4, "maxnreg": null, "pre_hook": null, "ir_override": null}, [0.01548799965530634, 0.015296000055968761, 0.016448000445961952]], [{"kwargs": {}, "num_warps": 4, "num_ctas": 1, "num_stages": 2, "maxnreg": null, "pre_hook": null, "ir_override": null}, [0.01532800029963255, 0.014495999552309513, 0.015552000142633915]], [{"kwargs": {}, "num_warps": 4, "num_ctas": 1, "num_stages": 3, "maxnreg": null, "pre_hook": null, "ir_override": null}, [0.015296000055968761, 0.014655999839305878, 0.015903999656438884]], [{"kwargs": {}, "num_warps": 4, "num_ctas": 1, "num_stages": 4, "maxnreg": null, "pre_hook": null, "ir_override": null}, [0.015200000256299973, 0.014560000039637089, 0.016383999958634377]], [{"kwargs": {}, "num_warps": 8, "num_ctas": 1, "num_stages": 2, "maxnreg": null, "pre_hook": null, "ir_override": null}, [0.015168000012636185, 0.014560000039637089, 0.01635199971497059]], [{"kwargs": {}, "num_warps": 8, "num_ctas": 1, "num_stages": 3, "maxnreg": null, "pre_hook": null, "ir_override": null}, [0.01532800029963255, 0.014751999638974667, 0.015456000342965126]], [{"kwargs": {}, "num_warps": 8, "num_ctas": 1, "num_stages": 4, "maxnreg": null, "pre_hook": null, "ir_override": null}, [0.014655999839305878, 0.0144640002399683, 0.015584000386297703]], [{"kwargs": {}, "num_warps": 16, "num_ctas": 1, "num_stages": 2, "maxnreg": null, "pre_hook": null, "ir_override": null}, [0.016383999958634377, 0.01635199971497059, 0.01651199907064438]], [{"kwargs": {}, "num_warps": 16, "num_ctas": 1, "num_stages": 3, "maxnreg": null, "pre_hook": null, "ir_override": null}, [0.016416000202298164, 0.01635199971497059, 0.017216000705957413]], [{"kwargs": {}, "num_warps": 16, "num_ctas": 1, "num_stages": 4, "maxnreg": null, "pre_hook": null, "ir_override": null}, [0.016383999958634377, 0.01635199971497059, 0.01651199907064438]], [{"kwargs": {}, "num_warps": 32, "num_ctas": 1, "num_stages": 2, "maxnreg": null, "pre_hook": null, "ir_override": null}, [0.02252800017595291, 0.022463999688625336, 0.022655999287962914]], [{"kwargs": {}, "num_warps": 32, "num_ctas": 1, "num_stages": 3, "maxnreg": null, "pre_hook": null, "ir_override": null}, [0.02252800017595291, 0.022463999688625336, 0.022655999287962914]], [{"kwargs": {}, "num_warps": 32, "num_ctas": 1, "num_stages": 4, "maxnreg": null, "pre_hook": null, "ir_override": null}, [0.02252800017595291, 0.022463999688625336, 0.022655999287962914]]]}