lact/.cache_triton_llm/2RDYIJSXZ75GXM2E7HODYTOS4X5JTWQM5VCKTZ3XTHOOXUHOWBEQ/rotary_embedding_kernel.autotune.json
{"key": [8, 12, 64, false, "torch.float32", "torch.float32", "torch.float32", "torch.float32"], "configs_timings": [[{"kwargs": {}, "num_warps": 2, "num_ctas": 1, "num_stages": 2, "maxnreg": null, "pre_hook": null, "ir_override": null}, [0.04095999896526337, 0.040192000567913055, 0.040991999208927155]], [{"kwargs": {}, "num_warps": 2, "num_ctas": 1, "num_stages": 3, "maxnreg": null, "pre_hook": null, "ir_override": null}, [0.04095999896526337, 0.04016000032424927, 0.04102399945259094]], [{"kwargs": {}, "num_warps": 2, "num_ctas": 1, "num_stages": 4, "maxnreg": null, "pre_hook": null, "ir_override": null}, [0.04095999896526337, 0.04028800129890442, 0.040991999208927155]], [{"kwargs": {}, "num_warps": 4, "num_ctas": 1, "num_stages": 2, "maxnreg": null, "pre_hook": null, "ir_override": null}, [0.04092799872159958, 0.03932800143957138, 0.040991999208927155]], [{"kwargs": {}, "num_warps": 4, "num_ctas": 1, "num_stages": 3, "maxnreg": null, "pre_hook": null, "ir_override": null}, [0.04092799872159958, 0.03932800143957138, 0.040991999208927155]], [{"kwargs": {}, "num_warps": 4, "num_ctas": 1, "num_stages": 4, "maxnreg": null, "pre_hook": null, "ir_override": null}, [0.04092799872159958, 0.03932800143957138, 0.040991999208927155]], [{"kwargs": {}, "num_warps": 8, "num_ctas": 1, "num_stages": 2, "maxnreg": null, "pre_hook": null, "ir_override": null}, [0.039103999733924866, 0.03891199827194214, 0.03984000161290169]], [{"kwargs": {}, "num_warps": 8, "num_ctas": 1, "num_stages": 3, "maxnreg": null, "pre_hook": null, "ir_override": null}, [0.03907199949026108, 0.03891199827194214, 0.03984000161290169]], [{"kwargs": {}, "num_warps": 8, "num_ctas": 1, "num_stages": 4, "maxnreg": null, "pre_hook": null, "ir_override": null}, [0.03903999924659729, 0.03891199827194214, 0.0398080013692379]], [{"kwargs": {}, "num_warps": 16, "num_ctas": 1, "num_stages": 2, "maxnreg": null, "pre_hook": null, "ir_override": null}, [0.04505600035190582, 0.045024000108242035, 0.045184001326560974]], [{"kwargs": {}, "num_warps": 16, "num_ctas": 1, "num_stages": 3, "maxnreg": null, "pre_hook": null, "ir_override": null}, [0.04505600035190582, 0.045024000108242035, 0.04521600157022476]], [{"kwargs": {}, "num_warps": 16, "num_ctas": 1, "num_stages": 4, "maxnreg": null, "pre_hook": null, "ir_override": null}, [0.04505600035190582, 0.045024000108242035, 0.045184001326560974]], [{"kwargs": {}, "num_warps": 32, "num_ctas": 1, "num_stages": 2, "maxnreg": null, "pre_hook": null, "ir_override": null}, [0.06758400052785873, 0.06755200028419495, 0.0678912028670311]], [{"kwargs": {}, "num_warps": 32, "num_ctas": 1, "num_stages": 3, "maxnreg": null, "pre_hook": null, "ir_override": null}, [0.06761600077152252, 0.06755200028419495, 0.06777600198984146]], [{"kwargs": {}, "num_warps": 32, "num_ctas": 1, "num_stages": 4, "maxnreg": null, "pre_hook": null, "ir_override": null}, [0.06758400052785873, 0.06755200028419495, 0.06780800223350525]]]}