lact/.cache_triton_llm/3E7MW7LTCKUBIQFIGBWAQQ4OX2UC4S5HBPHU4Q4FHW2IJMPWIMEQ/layer_norm_fwd_kernel.autotune.json
{"key": [192, 192, false, false, true, "torch.bfloat16", "torch.bfloat16", "torch.float32", "torch.float32"], "configs_timings": [[{"kwargs": {"BT": 32}, "num_warps": 2, "num_ctas": 1, "num_stages": 3, "maxnreg": null, "pre_hook": null, "ir_override": null}, [0.22323200106620789, 0.22313599288463593, 0.22332799434661865]], [{"kwargs": {"BT": 32}, "num_warps": 4, "num_ctas": 1, "num_stages": 3, "maxnreg": null, "pre_hook": null, "ir_override": null}, [0.1393599957227707, 0.13926400244235992, 0.14131200313568115]], [{"kwargs": {"BT": 32}, "num_warps": 8, "num_ctas": 1, "num_stages": 3, "maxnreg": null, "pre_hook": null, "ir_override": null}, [0.07577600330114365, 0.0752703994512558, 0.07587199658155441]], [{"kwargs": {"BT": 64}, "num_warps": 2, "num_ctas": 1, "num_stages": 3, "maxnreg": null, "pre_hook": null, "ir_override": null}, [0.5679680109024048, 0.5657919883728028, 0.5703743934631348]], [{"kwargs": {"BT": 64}, "num_warps": 4, "num_ctas": 1, "num_stages": 3, "maxnreg": null, "pre_hook": null, "ir_override": null}, [0.23347200453281403, 0.23334400355815887, 0.2335679978132248]], [{"kwargs": {"BT": 64}, "num_warps": 8, "num_ctas": 1, "num_stages": 3, "maxnreg": null, "pre_hook": null, "ir_override": null}, [0.15158399939537048, 0.1515199989080429, 0.15238399803638458]], [{"kwargs": {"BT": 128}, "num_warps": 2, "num_ctas": 1, "num_stages": 3, "maxnreg": null, "pre_hook": null, "ir_override": null}, [0.7588160037994385, 0.7557439804077148, 0.7614015817642212]], [{"kwargs": {"BT": 128}, "num_warps": 4, "num_ctas": 1, "num_stages": 3, "maxnreg": null, "pre_hook": null, "ir_override": null}, [0.5654399991035461, 0.5642560124397278, 0.567513620853424]], [{"kwargs": {"BT": 128}, "num_warps": 8, "num_ctas": 1, "num_stages": 3, "maxnreg": null, "pre_hook": null, "ir_override": null}, [0.24780799448490143, 0.24774399399757385, 0.24793599545955658]]]}