lact/.cache_triton_llm/HU74ZOIWADNFPEUSJNXECSLSFHENRJFOESQQ6T23LMB2C3D4VQIQ/layer_norm_bwd_kernel1.autotune.json
{"key": [768, true, false, true, "torch.float32", "torch.float32", "torch.float32", "torch.float32", "torch.float32", "torch.float32", "torch.float32"], "configs_timings": [[{"kwargs": {}, "num_warps": 2, "num_ctas": 1, "num_stages": 3, "maxnreg": null, "pre_hook": null, "ir_override": null}, [0.09014400094747543, 0.09011200070381165, 0.09030400216579437]], [{"kwargs": {}, "num_warps": 4, "num_ctas": 1, "num_stages": 3, "maxnreg": null, "pre_hook": null, "ir_override": null}, [0.0880960002541542, 0.08806400001049042, 0.08825600147247314]], [{"kwargs": {}, "num_warps": 8, "num_ctas": 1, "num_stages": 3, "maxnreg": null, "pre_hook": null, "ir_override": null}, [0.08604799956083298, 0.08601599931716919, 0.08687999844551086]]]}