lact/.cache_triton_llm/2EBN6457L3FYZ5D2QJXP6RS64IUWBVBDSPMJVCNSRZGLOCWWRA5A/layer_norm_bwd_kernel.autotune.json
{"key": [192, 192, false, false, true, "torch.bfloat16", "torch.float32", "torch.bfloat16", "torch.bfloat16", "torch.float32", "torch.float32"], "configs_timings": [[{"kwargs": {"BT": 32}, "num_warps": 2, "num_ctas": 1, "num_stages": 3, "maxnreg": null, "pre_hook": null, "ir_override": null}, [0.597823977470398, 0.5960000157356262, 0.5980799794197083]], [{"kwargs": {"BT": 32}, "num_warps": 4, "num_ctas": 1, "num_stages": 3, "maxnreg": null, "pre_hook": null, "ir_override": null}, [0.21916800737380981, 0.21904000639915466, 0.22002560496330262]], [{"kwargs": {"BT": 32}, "num_warps": 8, "num_ctas": 1, "num_stages": 3, "maxnreg": null, "pre_hook": null, "ir_override": null}, [0.272352010011673, 0.2707839906215668, 0.2724800109863281]], [{"kwargs": {"BT": 64}, "num_warps": 2, "num_ctas": 1, "num_stages": 3, "maxnreg": null, "pre_hook": null, "ir_override": null}, [3.340320110321045, 3.2956608295440675, 3.4061439514160154]], [{"kwargs": {"BT": 64}, "num_warps": 4, "num_ctas": 1, "num_stages": 3, "maxnreg": null, "pre_hook": null, "ir_override": null}, [0.41574400663375854, 0.4138239920139313, 0.4177472114562988]], [{"kwargs": {"BT": 64}, "num_warps": 8, "num_ctas": 1, "num_stages": 3, "maxnreg": null, "pre_hook": null, "ir_override": null}, [0.1454080045223236, 0.14448000490665436, 0.14553600549697876]]]}