lact/.cache_triton_llm/Q6S5ND6ZKESIE7O7SEZW5INZHBDGTWVY4Q3ILNDEYIZH7NLA7BUQ/layer_norm_fwd_kernel.autotune.json
{"key": [192, 64, false, false, true, "torch.bfloat16", "torch.bfloat16", "torch.float32", "torch.float32"], "configs_timings": [[{"kwargs": {"BT": 32}, "num_warps": 2, "num_ctas": 1, "num_stages": 3, "maxnreg": null, "pre_hook": null, "ir_override": null}, [0.08086399734020233, 0.08057600259780884, 0.08191999793052673]], [{"kwargs": {"BT": 32}, "num_warps": 4, "num_ctas": 1, "num_stages": 3, "maxnreg": null, "pre_hook": null, "ir_override": null}, [0.053247999399900436, 0.052191998809576035, 0.053279999643564224]], [{"kwargs": {"BT": 32}, "num_warps": 8, "num_ctas": 1, "num_stages": 3, "maxnreg": null, "pre_hook": null, "ir_override": null}, [0.0307839997112751, 0.030719999223947525, 0.0315839983522892]], [{"kwargs": {"BT": 64}, "num_warps": 2, "num_ctas": 1, "num_stages": 3, "maxnreg": null, "pre_hook": null, "ir_override": null}, [0.19046400487422943, 0.18934400379657745, 0.19120000302791595]], [{"kwargs": {"BT": 64}, "num_warps": 4, "num_ctas": 1, "num_stages": 3, "maxnreg": null, "pre_hook": null, "ir_override": null}, [0.08396799862384796, 0.08396799862384796, 0.0841279998421669]], [{"kwargs": {"BT": 64}, "num_warps": 8, "num_ctas": 1, "num_stages": 3, "maxnreg": null, "pre_hook": null, "ir_override": null}, [0.05555199831724167, 0.05532800033688545, 0.05619199946522713]], [{"kwargs": {"BT": 128}, "num_warps": 2, "num_ctas": 1, "num_stages": 3, "maxnreg": null, "pre_hook": null, "ir_override": null}, [0.30792000889778137, 0.3071039915084839, 0.30928000807762146]], [{"kwargs": {"BT": 128}, "num_warps": 4, "num_ctas": 1, "num_stages": 3, "maxnreg": null, "pre_hook": null, "ir_override": null}, [0.18931199610233307, 0.18848000466823578, 0.190528005361557]], [{"kwargs": {"BT": 128}, "num_warps": 8, "num_ctas": 1, "num_stages": 3, "maxnreg": null, "pre_hook": null, "ir_override": null}, [0.08806400001049042, 0.08803199976682663, 0.08825600147247314]]]}