lact/.cache_triton_llm/ZLQKLK5NANWUWRP7JF3OLNQDUWXWXCL24FZJLDKPEWTC7LZNNINQ/layer_norm_bwd_kernel1.autotune.json
{"key": [768, false, false, true, "torch.float32", "torch.float32", "torch.float32", "torch.float32", "torch.float32", "torch.float32"], "configs_timings": [[{"kwargs": {}, "num_warps": 2, "num_ctas": 1, "num_stages": 3, "maxnreg": null, "pre_hook": null, "ir_override": null}, [0.059328000992536545, 0.05817599967122078, 0.05942400172352791]], [{"kwargs": {}, "num_warps": 4, "num_ctas": 1, "num_stages": 3, "maxnreg": null, "pre_hook": null, "ir_override": null}, [0.05772799998521805, 0.05737600103020668, 0.059270400553941734]], [{"kwargs": {}, "num_warps": 8, "num_ctas": 1, "num_stages": 3, "maxnreg": null, "pre_hook": null, "ir_override": null}, [0.05843200162053108, 0.057631999254226685, 0.05942400172352791]]]}