lact/.cache_triton_llm/55XAOXU5S2ALIJ5ESM2AIIXY3JVFWVMODFSHJ7NPTTLJX32PQ23Q/rotary_embedding_kernel.autotune.json
{"key": [24, 12, 64, false, "torch.float32", "torch.float32", "torch.float32", "torch.float32"], "configs_timings": [[{"kwargs": {}, "num_warps": 2, "num_ctas": 1, "num_stages": 2, "maxnreg": null, "pre_hook": null, "ir_override": null}, [0.10857599973678589, 0.10844799876213074, 0.10864000022411346]], [{"kwargs": {}, "num_warps": 2, "num_ctas": 1, "num_stages": 3, "maxnreg": null, "pre_hook": null, "ir_override": null}, [0.1085439994931221, 0.10827519744634628, 0.10864000022411346]], [{"kwargs": {}, "num_warps": 2, "num_ctas": 1, "num_stages": 4, "maxnreg": null, "pre_hook": null, "ir_override": null}, [0.1085439994931221, 0.1082431972026825, 0.10864000022411346]], [{"kwargs": {}, "num_warps": 4, "num_ctas": 1, "num_stages": 2, "maxnreg": null, "pre_hook": null, "ir_override": null}, [0.10652799904346466, 0.10646399855613708, 0.10681600123643875]], [{"kwargs": {}, "num_warps": 4, "num_ctas": 1, "num_stages": 3, "maxnreg": null, "pre_hook": null, "ir_override": null}, [0.10655999928712845, 0.10646399855613708, 0.1068992018699646]], [{"kwargs": {}, "num_warps": 4, "num_ctas": 1, "num_stages": 4, "maxnreg": null, "pre_hook": null, "ir_override": null}, [0.10652799904346466, 0.10646399855613708, 0.10672000050544739]], [{"kwargs": {}, "num_warps": 8, "num_ctas": 1, "num_stages": 2, "maxnreg": null, "pre_hook": null, "ir_override": null}, [0.1024319976568222, 0.10236799716949463, 0.10252799838781357]], [{"kwargs": {}, "num_warps": 8, "num_ctas": 1, "num_stages": 3, "maxnreg": null, "pre_hook": null, "ir_override": null}, [0.1024319976568222, 0.10236799716949463, 0.10252799838781357]], [{"kwargs": {}, "num_warps": 8, "num_ctas": 1, "num_stages": 4, "maxnreg": null, "pre_hook": null, "ir_override": null}, [0.1024319976568222, 0.10236799716949463, 0.10252799838781357]], [{"kwargs": {}, "num_warps": 16, "num_ctas": 1, "num_stages": 2, "maxnreg": null, "pre_hook": null, "ir_override": null}, [0.11878400295972824, 0.11872000247240067, 0.1189119964838028]], [{"kwargs": {}, "num_warps": 16, "num_ctas": 1, "num_stages": 3, "maxnreg": null, "pre_hook": null, "ir_override": null}, [0.11878400295972824, 0.11868800222873688, 0.11885440349578857]], [{"kwargs": {}, "num_warps": 16, "num_ctas": 1, "num_stages": 4, "maxnreg": null, "pre_hook": null, "ir_override": null}, [0.11878400295972824, 0.11872000247240067, 0.1188800036907196]], [{"kwargs": {}, "num_warps": 32, "num_ctas": 1, "num_stages": 2, "maxnreg": null, "pre_hook": null, "ir_override": null}, [0.18835200369358063, 0.18646399676799774, 0.1884479969739914]], [{"kwargs": {}, "num_warps": 32, "num_ctas": 1, "num_stages": 3, "maxnreg": null, "pre_hook": null, "ir_override": null}, [0.18831999599933624, 0.18639999628067017, 0.1884479969739914]], [{"kwargs": {}, "num_warps": 32, "num_ctas": 1, "num_stages": 4, "maxnreg": null, "pre_hook": null, "ir_override": null}, [0.18831999599933624, 0.18639999628067017, 0.1884479969739914]]]}