lact/.cache_triton_llm/YFJTVMS3WSGTHROB7F5L37XDASRZEYL6IBYP5D2K7AXFZP7345CA/layer_norm_bwd_kernel.autotune.json
{"key": [192, 64, false, false, true, "torch.bfloat16", "torch.float32", "torch.bfloat16", "torch.bfloat16", "torch.float32", "torch.float32"], "configs_timings": [[{"kwargs": {"BT": 32}, "num_warps": 2, "num_ctas": 1, "num_stages": 3, "maxnreg": null, "pre_hook": null, "ir_override": null}, [0.24038399755954742, 0.2396160066127777, 0.24166400730609894]], [{"kwargs": {"BT": 32}, "num_warps": 4, "num_ctas": 1, "num_stages": 3, "maxnreg": null, "pre_hook": null, "ir_override": null}, [0.08022399991750717, 0.0799039974808693, 0.0809599980711937]], [{"kwargs": {"BT": 32}, "num_warps": 8, "num_ctas": 1, "num_stages": 3, "maxnreg": null, "pre_hook": null, "ir_override": null}, [0.0952640026807785, 0.09459199756383896, 0.0963200032711029]], [{"kwargs": {"BT": 64}, "num_warps": 2, "num_ctas": 1, "num_stages": 3, "maxnreg": null, "pre_hook": null, "ir_override": null}, [1.095200002193451, 1.079360008239746, 1.1121280193328857]], [{"kwargs": {"BT": 64}, "num_warps": 4, "num_ctas": 1, "num_stages": 3, "maxnreg": null, "pre_hook": null, "ir_override": null}, [0.14134399592876434, 0.14030079841613768, 0.14217600226402283]], [{"kwargs": {"BT": 64}, "num_warps": 8, "num_ctas": 1, "num_stages": 3, "maxnreg": null, "pre_hook": null, "ir_override": null}, [0.05737600103020668, 0.0572223998606205, 0.05750399827957153]]]}