lact/.cache_triton_llm/DRXOHAIOP5OJ6VDOEEIKA63Y5JDJX7M7V2RKFR37LX5H3CXLO6NA/swiglu_fwd_kernel.autotune.json
{"key": [2048, "torch.bfloat16", "torch.bfloat16", "torch.bfloat16"], "configs_timings": [[{"kwargs": {"B": 512}, "num_warps": 1, "num_ctas": 1, "num_stages": 3, "maxnreg": null, "pre_hook": null, "ir_override": null}, [0.03686400130391121, 0.03680000081658363, 0.03702399879693985]], [{"kwargs": {"B": 512}, "num_warps": 2, "num_ctas": 1, "num_stages": 3, "maxnreg": null, "pre_hook": null, "ir_override": null}, [0.03686400130391121, 0.03580800071358681, 0.036896001547575]], [{"kwargs": {"B": 512}, "num_warps": 4, "num_ctas": 1, "num_stages": 3, "maxnreg": null, "pre_hook": null, "ir_override": null}, [0.030719999223947525, 0.029823999851942062, 0.03081599995493889]], [{"kwargs": {"B": 512}, "num_warps": 8, "num_ctas": 1, "num_stages": 3, "maxnreg": null, "pre_hook": null, "ir_override": null}, [0.04095999896526337, 0.03984000161290169, 0.040991999208927155]], [{"kwargs": {"B": 512}, "num_warps": 16, "num_ctas": 1, "num_stages": 3, "maxnreg": null, "pre_hook": null, "ir_override": null}, [0.06348799914121628, 0.06348799914121628, 0.06431999802589417]], [{"kwargs": {"B": 512}, "num_warps": 32, "num_ctas": 1, "num_stages": 3, "maxnreg": null, "pre_hook": null, "ir_override": null}, [0.12505599856376648, 0.12492799758911133, 0.1258240044116974]], [{"kwargs": {"B": 1024}, "num_warps": 1, "num_ctas": 1, "num_stages": 3, "maxnreg": null, "pre_hook": null, "ir_override": null}, [0.051231998950242996, 0.05119999870657921, 0.05206400156021118]], [{"kwargs": {"B": 1024}, "num_warps": 2, "num_ctas": 1, "num_stages": 3, "maxnreg": null, "pre_hook": null, "ir_override": null}, [0.037856001406908035, 0.037151999771595, 0.038943998515605927]], [{"kwargs": {"B": 1024}, "num_warps": 4, "num_ctas": 1, "num_stages": 3, "maxnreg": null, "pre_hook": null, "ir_override": null}, [0.03686400130391121, 0.035711999982595444, 0.036896001547575]], [{"kwargs": {"B": 1024}, "num_warps": 8, "num_ctas": 1, "num_stages": 3, "maxnreg": null, "pre_hook": null, "ir_override": null}, [0.030719999223947525, 0.030592000111937523, 0.030848000198602676]], [{"kwargs": {"B": 1024}, "num_warps": 16, "num_ctas": 1, "num_stages": 3, "maxnreg": null, "pre_hook": null, "ir_override": null}, [0.043007999658584595, 0.041919998824596405, 0.04303999990224838]], [{"kwargs": {"B": 1024}, "num_warps": 32, "num_ctas": 1, "num_stages": 3, "maxnreg": null, "pre_hook": null, "ir_override": null}, [0.06758400052785873, 0.06752000004053116, 0.06774400174617767]], [{"kwargs": {"B": 2048}, "num_warps": 1, "num_ctas": 1, "num_stages": 3, "maxnreg": null, "pre_hook": null, "ir_override": null}, [0.05632000043988228, 0.05552000179886818, 0.05737600103020668]], [{"kwargs": {"B": 2048}, "num_warps": 2, "num_ctas": 1, "num_stages": 3, "maxnreg": null, "pre_hook": null, "ir_override": null}, [0.04915200173854828, 0.04800000041723251, 0.049215998500585556]], [{"kwargs": {"B": 2048}, "num_warps": 4, "num_ctas": 1, "num_stages": 3, "maxnreg": null, "pre_hook": null, "ir_override": null}, [0.04124800115823746, 0.04095999896526337, 0.041919998824596405]], [{"kwargs": {"B": 2048}, "num_warps": 8, "num_ctas": 1, "num_stages": 3, "maxnreg": null, "pre_hook": null, "ir_override": null}, [0.03891199827194214, 0.03884800150990486, 0.03907199949026108]], [{"kwargs": {"B": 2048}, "num_warps": 16, "num_ctas": 1, "num_stages": 3, "maxnreg": null, "pre_hook": null, "ir_override": null}, [0.0315839983522892, 0.030848000198602676, 0.03280000016093254]], [{"kwargs": {"B": 2048}, "num_warps": 32, "num_ctas": 1, "num_stages": 3, "maxnreg": null, "pre_hook": null, "ir_override": null}, [0.04303999990224838, 0.043007999658584595, 0.043884798884391785]], [{"kwargs": {"B": 4096}, "num_warps": 1, "num_ctas": 1, "num_stages": 3, "maxnreg": null, "pre_hook": null, "ir_override": null}, [0.1926400065422058, 0.19251200556755066, 0.1934400051832199]], [{"kwargs": {"B": 4096}, "num_warps": 2, "num_ctas": 1, "num_stages": 3, "maxnreg": null, "pre_hook": null, "ir_override": null}, [0.053247999399900436, 0.05318399891257286, 0.05337600037455559]], [{"kwargs": {"B": 4096}, "num_warps": 4, "num_ctas": 1, "num_stages": 3, "maxnreg": null, "pre_hook": null, "ir_override": null}, [0.05027199909090996, 0.04979199916124344, 0.051231998950242996]], [{"kwargs": {"B": 4096}, "num_warps": 8, "num_ctas": 1, "num_stages": 3, "maxnreg": null, "pre_hook": null, "ir_override": null}, [0.04323200136423111, 0.043007999658584595, 0.04390399903059006]], [{"kwargs": {"B": 4096}, "num_warps": 16, "num_ctas": 1, "num_stages": 3, "maxnreg": null, "pre_hook": null, "ir_override": null}, [0.045951999723911285, 0.0453759990632534, 0.04710400104522705]], [{"kwargs": {"B": 4096}, "num_warps": 32, "num_ctas": 1, "num_stages": 3, "maxnreg": null, "pre_hook": null, "ir_override": null}, [0.03580800071358681, 0.03519999980926514, 0.036896001547575]], [{"kwargs": {"B": 8192}, "num_warps": 1, "num_ctas": 1, "num_stages": 3, "maxnreg": null, "pre_hook": null, "ir_override": null}, [0.2951360046863556, 0.2948479950428009, 0.2970559895038605]], [{"kwargs": {"B": 8192}, "num_warps": 2, "num_ctas": 1, "num_stages": 3, "maxnreg": null, "pre_hook": null, "ir_override": null}, [0.13734400272369385, 0.1372160017490387, 0.13821440041065217]], [{"kwargs": {"B": 8192}, "num_warps": 4, "num_ctas": 1, "num_stages": 3, "maxnreg": null, "pre_hook": null, "ir_override": null}, [0.07585599645972252, 0.07577600330114365, 0.07740800082683563]], [{"kwargs": {"B": 8192}, "num_warps": 8, "num_ctas": 1, "num_stages": 3, "maxnreg": null, "pre_hook": null, "ir_override": null}, [0.05737600103020668, 0.05734400078654289, 0.05801599845290184]], [{"kwargs": {"B": 8192}, "num_warps": 16, "num_ctas": 1, "num_stages": 3, "maxnreg": null, "pre_hook": null, "ir_override": null}, [0.051231998950242996, 0.05116799846291542, 0.05193600058555603]], [{"kwargs": {"B": 8192}, "num_warps": 32, "num_ctas": 1, "num_stages": 3, "maxnreg": null, "pre_hook": null, "ir_override": null}, [0.05942400172352791, 0.05936000123620033, 0.060095999389886856]]]}